{
    "fonts":{
        "font": "fonts/Inconsolata-Regular.ttf",
        "fontSize": 8,
        "fontBold": "fonts/Inconsolata-Bold.ttf",
        "fontItalic": "fonts/Inconsolata-Italic.ttf",
        "fontName": "Inconsolata",
        "fontBoldName": "InconsolataBold",
        "fontItalicName": "Inconsolata Italic",
        "fontFamily": "Inconsolata",
        "fontColor": "#FF8100",
        "titleFontSize": 16

    },
    "paragraph": { "name": "Content",
                "spaceAfter": 0.1
    },
    "page": {
        "height" : 11,
        "width" : 8.5,
        "margin": [0.5, 0.7, 0.4, 0.4],
        "pageSize": "letter",
        "styles": "Normal"

    },
    "tableStyles":{
        "valign": "TOP",
        "align": "LEFT",
        "colWidths": [0.8, 6.9]
    },
    "ordering":{
        "body": [
            "summary",
            "education",
            "skills",
            "experience",
            "projects",
            "volunteer",
            "awards",
            "publications"
        ]
    },
    "head":{
        "leftTop": "name",
        "leftBot": "phone",
        "rightTop": "website",
        "centerBot": "address",
        "centerTop": false,
        "rightBot": "email"

    },
    "headAln": {
        "leftTop": [0.4, 0.4],
        "leftBot": [0.4, 0.6],
        "rightTop": [0.4, 0.4],
        "centerBot": [2.0, 0.6],
        "centerTop": [2.0, 0.4],
        "rightBot": [0.4, 0.6]
    },
    "headTitle": {
        "leftTop": true,
        "leftBot": false,
        "rightTop": false,
        "centerBot": false,
        "centerTop": false,
        "rightBot": false
    },
    "headLine": [0.4, 0.47, 0.4, 0.47],
    "multiCol": false
    
}